{
  "generated_at": "2026-05-07T07:00:00Z",
  "city_id": "bangalore_demo",
  "h3_resolution": 8,
  "data_quality_flag": "real",
  "summary": {
    "city_median_temperature_c": 28.8,
    "max_heat_risk_score": 0.79,
    "high_risk_cell_count": 1,
    "total_cells": 3
  },
  "heat_cells": [
    {
      "h3_id": "882a100d73fffff",
      "heat_index_c": 30.1,
      "uhi_intensity": 1.3,
      "green_cover_fraction": 0.01,
      "water_proximity_score": 0.00,
      "heat_risk_score": 0.79
    },
    {
      "h3_id": "882a100d5bfffff",
      "heat_index_c": 29.5,
      "uhi_intensity": 0.7,
      "green_cover_fraction": 0.08,
      "water_proximity_score": 0.10,
      "heat_risk_score": 0.51
    },
    {
      "h3_id": "882a100d57fffff",
      "heat_index_c": 27.9,
      "uhi_intensity": -0.9,
      "green_cover_fraction": 0.42,
      "water_proximity_score": 0.85,
      "heat_risk_score": 0.12
    }
  ],
  "active_warnings": [
    {
      "warning_id": "idw_interpolation_in_use",
      "severity": "info",
      "message": "Heat index values are IDW-interpolated from sparse grid points; not direct measurements."
    }
  ],
  "provenance_summary": {
    "sources": ["openmeteo", "osm_via_osmnx"],
    "synthetic_used": false
  }
}
